,title,institute,rate,ratingscount,level,enrollment,review_num,required_hour
291,Leveraging Unstructured Data with Cloud Dataproc on Google Cloud em Português Brasileiro,Google Cloud,4.6,13,2,,,11.0
292,Mathematical Biostatistics Boot Camp 2,Johns Hopkins University,4.4,99,0,,,17.0
293,Introduction to Machine Learning in Sports Analytics,University of Michigan,4.5,,2,,,13.0
294,Machine Learning: Classification,University of Washington,4.7,3596,0,110915,597,21.0
295,Wearable Technologies and Sports Analytics,University of Michigan,4.5,,2,,,28.0
296,Reinforcement Learning: Qwik Start,Google Cloud,4.5,,1,,,1.0
297,Metodología de la ciencia de datos,IBM,4.8,20,1,,3,10.0
298,Measurement – Turning Concepts into Data,Johns Hopkins University,4.8,45,1,,15,11.0
299,Introduction to Data Science and scikit-learn in Python,LearnQuest,4.5,,1,,,14.0
300,Practical Crowdsourcing for Efficient Machine Learning,Yandex,3.0,6,1,6560,,17.0
301,Введение в теорию построения процедур множественной проверки гипотез,HSE University,4.5,,2,,,17.0
302,Functional Programming in Scala Capstone,École Polytechnique Fédérale de Lausanne,4.4,530,0,12142,91,27.0
303,Command Line Tools for Genomic Data Science,Johns Hopkins University,4.1,465,0,,,17.0
304,Linear Regression for Business Statistics,Rice University,4.8,1214,0,34299,200,28.0
305,Natural Language Processing in Microsoft Azure,Microsoft,4.9,14,1,,,8.0
306,Analyzing Big Data with SQL,Cloudera,4.9,430,1,19850,115,18.0
307,Predictive Modeling with Logistic Regression using SAS,SAS,4.6,28,2,1535,7,17.0
308,Business Analytics and Digital Media,Indian School of Business,4.4,642,1,20420,134,8.0
309,Introduction to Bayesian Statistics,Databricks,2.7,11,1,,,13.0
310,Introduction to Clinical Data Science,University of Colorado System,4.6,298,2,11829,88,8.0
311,Sequence Models for Time Series and Natural Language Processing,Google Cloud,4.4,463,3,14017,66,15.0
312,Big Data: adquisición y almacenamiento de datos,Universitat Autònoma de Barcelona,4.4,581,2,14673,258,11.0
313,Information Visualization: Advanced Techniques,New York University,4.7,29,2,3327,10,16.0
314,Advanced AI Techniques for the Supply Chain,LearnQuest,4.5,,2,,,22.0
315,Information Visualization: Applied Perception,New York University,4.8,93,1,3638,28,12.0
316,تحليل البيانات باستخدام بايثون,IBM,4.5,,1,,,18.0
317,Python: Istruzioni per l’uso,Università di Napoli Federico II,3.8,11,1,,,16.0
318,機器學習基石下 (Machine Learning Foundations)---Algorithmic Foundations,National Taiwan University,4.9,298,2,13298,55,9.0
319,Data Science with R - Capstone Project,IBM,4.5,,2,,,14.0
320,Conceptos Básicos de Excel para el Análisis de Datos,IBM,3.9,36,1,2242,19,12.0
321,Practicing for the SAS Programming Certification Exam,SAS,4.9,25,2,,2,9.0
322,Введение в данные,Novosibirsk State University ,4.7,154,2,9480,29,16.0
323,Fundamentals of Data Visualization,University of Colorado Boulder,4.5,,2,,,14.0
324,Ethical Issues in Data Science,University of Colorado Boulder,4.3,9,1,,,24.0
325,Data Analytics in Accounting Capstone,University of Illinois at Urbana-Champaign,4.5,,2,1714,,19.0
326,Pattern Discovery in Data Mining,University of Illinois at Urbana-Champaign,4.3,298,0,,,17.0
327,Bayesian Statistics,Duke University,3.8,759,2,,,17.0
328,"Business Intelligence Concepts, Tools, and Applications",University of Colorado System,4.5,582,0,,,17.0
329,Основы машинного обучения,HSE University,4.6,27,2,1914,,48.0
330,Fundamentals of Machine Learning for Supply Chain,LearnQuest,4.5,,1,,,13.0
331,AI Workflow: Data Analysis and Hypothesis Testing,IBM,4.2,90,3,2736,15,11.0
332,Building R Packages,Johns Hopkins University,4.1,211,2,9686,56,21.0
333,Managing Machine Learning Projects with Google Cloud,Google Cloud,4.6,3522,1,109398,927,14.0
334,Applied Data Science for Data Analysts,Databricks,4.2,24,2,1632,6,16.0
335,Advanced Linear Models for Data Science 1: Least Squares,Johns Hopkins University,4.4,157,3,24946,39,8.0
336,Machine Learning Rapid Prototyping with IBM Watson Studio,IBM,4.5,,2,,,9.0
337,Computer Simulations,"University of California, Davis",4.6,48,1,4423,12,13.0
338,Prediction Models with Sports Data,University of Michigan,4.5,,0,,,33.0
339,Machine Learning With Big Data,University of California San Diego,4.6,2347,0,,,17.0
340,Analyzing a Tennis Serve with the Video Intelligence API,Google Cloud,4.5,,2,,,1.0
341,"Data – What It Is, What We Can Do With It",Johns Hopkins University,4.5,70,1,2748,17,11.0
342,Accounting Data Analytics with Python,University of Illinois at Urbana-Champaign,4.1,50,2,7760,15,32.0
343,Basic Data Processing and Visualization,University of California San Diego,4.3,166,2,16803,48,11.0
344,Serverless Data Processing with Dataflow: Operations,Google Cloud,4.5,,3,,,10.0
345,Practical Machine Learning,Johns Hopkins University,4.5,3156,0,,,17.0
346,Predictive Modeling and Analytics,University of Colorado Boulder,3.6,534,0,27676,196,11.0
347,Fundamentos de probabilidad y aplicaciones,Universidad de los Andes,4.8,58,2,4005,21,16.0
348,Analytics en las organizaciones,Universidad de los Andes,4.8,11,1,,7,19.0
349,MongoDB Aggregation Framework,MongoDB Inc.,4.6,44,2,8246,11,19.0
350,The Fundamental of Data-Driven Investment,Sungkyunkwan University,4.5,,1,,,19.0
351,Redes Ecológicas,Universidade de São Paulo,5.0,19,1,,5,18.0
352,Graph Analytics for Big Data,University of California San Diego,4.3,1179,0,41945,224,13.0
353,Сбор и анализ данных в Python,HSE University,4.5,10,2,,6,21.0
354,Recommendation Systems with TensorFlow on GCP,Google Cloud,4.5,423,3,13824,73,13.0
355,Preparing for AI-900: Microsoft Azure AI Fundamentals exam,Microsoft,5.0,8,1,,,10.0
356,Herramientas para la ciencia de datos,IBM,4.4,23,1,,8,16.0
357,Cluster Analysis in Data Mining,University of Illinois at Urbana-Champaign,4.5,382,0,,,17.0
358,2D image processing,HSE University,4.5,,1,,,14.0
359,Bioconductor for Genomic Data Science,Johns Hopkins University,3.9,296,0,,,17.0
360,Managing Machine Learning Projects,Duke University,4.5,,1,,,18.0
361,Data Visualization with R,IBM,4.5,,1,,,10.0
362,Regression Modeling Fundamentals,SAS,4.8,24,2,,5,12.0
363,Big Data: el impacto de los datos masivos en la sociedad actual,Universitat Autònoma de Barcelona,4.7,1922,1,30802,724,7.0
364,Python для анализа данных,Moscow Institute of Physics and Technology,4.5,102,2,12969,23,37.0
365,Введение в анализ данных с помощью Excel,Rice University,4.5,,0,,,17.0
366,Developing AI Applications on Azure,LearnQuest,4.4,936,3,43655,257,16.0
367,Машинное обучение и большие данные,National Research Nuclear University MEPhI,4.5,,1,,,27.0
368,Regression Models,Johns Hopkins University,4.4,3264,0,,,17.0
369,Анализ данных с использованием Python,IBM,4.5,,1,,,19.0
370,Introduction to Neurohacking In R,Johns Hopkins University,4.6,253,2,19559,49,18.0
371,Fundamentals of Machine Learning in Finance,New York University,3.8,296,2,16074,62,18.0
372,¿Qué es la ciencia de datos?,IBM,4.7,74,1,,27,8.0
373,Reinforcement Learning in Finance,New York University,3.6,113,3,15794,30,17.0
374,Big Data Integration and Processing,University of California San Diego,4.4,2284,1,63773,493,18.0
375,Managing Big Data in Clusters and Cloud Storage,Cloudera,4.7,235,1,8845,53,21.0
376,Text Mining and Analytics,University of Illinois at Urbana-Champaign,4.5,646,0,,,17.0
377,Introduction to Statistical Analysis:  Hypothesis Testing,SAS,4.7,50,2,4231,13,10.0
378,Serverless Data Processing with Dataflow: Develop Pipelines,Google Cloud,4.2,9,3,,,19.0
379,Reproducible Research,Johns Hopkins University,4.6,4068,0,,,17.0
380,Business Applications of Hypothesis Testing and Confidence Interval Estimation,Rice University,4.8,1155,0,25323,201,25.0
381,ML Pipelines on Google Cloud,Google Cloud,3.9,20,3,3598,3,11.0
382,Introduction to Predictive Modeling,University of Minnesota,5.0,20,0,,7,12.0
383,Inferential Statistics,University of Amsterdam,4.3,515,0,,,17.0
384,Data Storage in Microsoft Azure,Microsoft,4.5,,2,,,16.0
385,Data Integration with Microsoft Azure Data Factory,Microsoft,4.5,,2,,,16.0
386,Advanced R Programming,Johns Hopkins University,4.3,544,2,28008,134,18.0
387,How to Win a Data Science Competition: Learn from Top Kagglers,HSE University,4.7,1100,3,103547,270,54.0
388,Preparing for the SAS Programming Certification Exam,SAS,4.8,28,2,,5,16.0
389,Linear Regression and Modeling,Duke University,4.7,1544,1,79007,286,10.0
390,Advanced Business Analytics Capstone,University of Colorado Boulder,4.3,53,0,6892,17,19.0
391,Data Visualization in R with ggplot2,Johns Hopkins University,5.0,53,2,2682,12,13.0
392,Google Cloud Big Data and Machine Learning Fundamentals 日本語版,Google Cloud,4.5,152,2,3882,16,13.0
393,Social Network Analysis,"University of California, Davis",4.7,157,1,,,17.0
394,Машинное обучение в финансах,SberUniversity,4.5,78,2,8769,35,21.0
395,Maps and the Geospatial Revolution,The Pennsylvania State University,4.7,211,1,,,17.0
396,Getting Started with CyberGIS,University of Illinois at Urbana-Champaign,4.5,,1,,,9.0
397,Data Science in Real Life,Johns Hopkins University,4.4,2254,0,,,17.0
398,Moneyball and Beyond,University of Michigan,4.8,12,0,,1,29.0
399,Principles of fMRI 2,Johns Hopkins University,4.7,207,0,,,17.0
400,Introducción al procesamiento de lenguaje natural,Universidad Austral,4.5,6,1,,,13.0
401,Natural Language Processing,HSE University,4.4,783,3,,,17.0
402,Introducción al Análisis de Datos,IBM,4.7,73,1,2605,27,11.0
403,Statistics for Genomic Data Science,Johns Hopkins University,4.2,296,0,,,17.0
404,Probabilistic Graphical Models 3: Learning,Stanford University,4.6,291,3,18191,51,66.0
405,Using Machine Learning in Trading and Finance,New York Institute of Finance,4.0,268,2,14169,69,19.0
406,Reinforcement Learning for Trading Strategies,New York Institute of Finance,3.7,172,2,9841,47,12.0
407,Advanced SAS Programming Techniques,SAS,4.9,44,2,,11,17.0
408,Data Analysis with R,IBM,4.9,16,2,1801,3,13.0
409,Прикладные задачи анализа данных,Moscow Institute of Physics and Technology,4.3,729,2,18131,112,28.0
410,3D Data Visualization for Science Communication,University of Illinois at Urbana-Champaign,4.5,,1,2920,,32.0
411,Exploratory Data Analysis,Johns Hopkins University,4.7,5908,0,,,17.0
412,Art and Science of Machine Learning,Google Cloud,4.6,1365,2,21971,119,19.0
413,Creating Advanced Reports with SAS Visual Analytics,SAS,4.7,165,2,7809,21,9.0
414,"Performing Network, Path, and Text Analyses in SAS Visual Analytics",SAS,4.7,168,2,6820,20,4.0
415,SQL for Data Science with R,IBM,3.8,14,1,1811,,15.0
416,Machine Learning: Regression,University of Washington,4.8,5378,0,142383,1002,22.0
417,Introducción a La Inteligencia Artificial (IA),IBM,4.6,101,1,3769,35,9.0
418,Inferential Statistics,Duke University,4.8,2219,1,,,17.0
419,Bancos de dados e SQL para Ciência de Dados,IBM,4.6,13,1,1921,3,14.0
420,Estadística aplicada a los negocios,Universidad Austral,4.6,640,1,46013,305,19.0
421,"Big Data, Artificial Intelligence, and Ethics","University of California, Davis",4.6,337,1,18326,93,12.0
422,Experimental Design Basics,Arizona State University,4.7,143,2,9217,36,13.0
423,Code Free Data Science,University of California San Diego,4.3,85,1,9999,29,14.0
424,Population Health: Predictive Analytics,Universiteit Leiden,5.0,12,2,2489,8,18.0
425,Basic Recommender Systems,EIT Digital ,3.9,17,2,,4,12.0
426,Introduction to People Analytics,Moscow Institute of Physics and Technology,4.3,329,0,,,17.0
427,Building AI Applications with Watson APIs,IBM,4.3,572,2,11375,127,17.0
428,Population Health: Responsible Data Analysis,Universiteit Leiden,4.6,25,1,3146,6,21.0
429,Probabilistic Deep Learning with TensorFlow 2,Imperial College London,4.7,54,3,7822,19,53.0
430,Microsoft Azure for Data Engineering,Microsoft,4.6,9,2,,,6.0
431,Web of Data,EIT Digital ,4.2,73,2,3997,19,18.0
432,Production Machine Learning Systems,Google Cloud,4.6,867,3,19734,94,21.0
433,Business Analytics Capstone,University of Pennsylvania,4.5,647,2,,,17.0
434,End-to-End Machine Learning with TensorFlow on GCP,Google Cloud,4.5,1578,3,51717,253,13.0
435,Applied Social Network Analysis in Python,University of Michigan,4.7,2479,2,81149,417,29.0
436,"Managing, Describing, and Analyzing Data",University of Colorado Boulder,4.3,15,1,2078,6,17.0
437,Big Data Modeling and Management Systems,University of California San Diego,4.4,2880,0,82301,491,13.0
438,A Complete Reinforcement Learning System (Capstone),University of Alberta,4.7,518,2,13232,110,16.0
439,Framework for Data Collection and Analysis,"University of Maryland, College Park",4.2,606,2,23227,139,10.0
440,Serverless Data Processing with Dataflow: Foundations,Google Cloud,4.2,17,2,1955,2,3.0
441,Fitting Statistical Models to Data with Python,University of Michigan,4.4,560,2,24317,103,15.0
442,Introduction to Deep Learning,HSE University,4.5,1811,3,165180,424,34.0
443,Machine Learning Using SAS Viya,SAS,4.7,79,2,,,17.0
444,Guided Tour of Machine Learning in Finance,New York University,3.8,607,2,26490,195,24.0
445,Поиск структуры в данных,Moscow Institute of Physics and Technology,4.7,1441,2,21114,163,31.0
446,Построение выводов по данным,Moscow Institute of Physics and Technology,4.7,1013,3,21650,153,27.0
447,Data Mining Pipeline,University of Colorado Boulder,4.5,,2,,,21.0
448,Text Retrieval and Search Engines,University of Illinois at Urbana-Champaign,4.5,845,0,,,17.0
449,Modern Regression Analysis in R,University of Colorado Boulder,4.5,,2,,,45.0
450,Econometrics,HSE University,4.3,8,2,,,17.0
451,Microsoft Azure Machine Learning,Microsoft,4.8,30,1,1742,4,11.0
452,Statistical Inference,Johns Hopkins University,4.2,4280,0,,,17.0
453,Managing Big Data with MySQL,Duke University,4.7,3765,0,,,17.0
454,Applied Text Mining in Python,University of Michigan,4.2,3548,2,117750,687,29.0
455,Getting Started with Data Visualization in R,Johns Hopkins University,4.8,112,1,5741,36,12.0
456,Mathematics for computer vision,HSE University,2.9,7,2,1524,,19.0
457,Algorithms for DNA Sequencing,Johns Hopkins University,4.7,733,0,,,17.0
458,機器學習基石上 (Machine Learning Foundations)---Mathematical Foundations,National Taiwan University,4.9,838,1,38293,153,10.0
459,Data Science Fundamentals for Data Analysts,Databricks,4.1,15,2,2759,,19.0
460,MLOps (Machine Learning Operations) Fundamentals,Google Cloud,4.0,282,2,20895,91,16.0
461,Feature Engineering,Google Cloud,4.5,1654,2,,,17.0
462,Deep Learning and Reinforcement Learning,IBM,4.7,58,2,5055,13,14.0
463,Advanced Data Science Capstone,IBM,4.6,361,3,12945,66,9.0
464,Statistical Inference for Estimation in Data Science,University of Colorado Boulder,4.5,,2,,,27.0
465,"Introduction to Trading, Machine Learning & GCP",Google Cloud,4.0,655,2,28640,180,9.0
466,AI Capstone Project with Deep Learning,IBM,4.5,347,3,9050,62,16.0
467,"Introduction to Data, Signal, and Image Analysis with MATLAB",Vanderbilt University,4.7,95,2,16030,32,23.0
468,Customising your models with TensorFlow 2,Imperial College London,4.8,120,2,9186,48,27.0
469,Using Data for Geographic Mapping and Forecasting in SAS Visual Analytics,SAS,4.8,183,2,7112,22,5.0
470,Data Analysis in R with RStudio & Tidyverse,Codio,4.5,,1,,,10.0
471,Exploratory Data Analysis with MATLAB,MathWorks,4.8,685,1,29698,195,19.0
472,"Basic Data Descriptors, Statistical Distributions, and Application to Business Decisions",Rice University,4.7,2100,0,43315,355,21.0
473,Interprofessional Healthcare Informatics,University of Minnesota,4.4,278,0,,,17.0
474,Social Media Data Analytics,University of Washington,4.1,266,2,34642,71,13.0
475,Data Visualization with Tableau Project,"University of California, Davis",4.6,398,2,20828,66,12.0
476,Análise de dados com Python,IBM,4.5,,1,,,19.0
477,"Machine Learning Under the Hood: The Technical Tips, Tricks, and Pitfalls",SAS,4.8,52,1,3329,23,17.0
478,Experimentation for Improvement,McMaster University,4.8,815,2,,,17.0
479,Specialized Models: Time Series and Survival Analysis,IBM,4.5,62,2,4983,19,11.0
480,Data Science as a Field,University of Colorado Boulder,4.9,7,2,,,10.0
481,Unsupervised Machine Learning,IBM,4.8,84,2,5124,20,9.0
482,SQL for Data Science Capstone Project,"University of California, Davis",3.8,59,2,16768,,35.0
483,Data Visualization and Communication with Tableau,Duke University,4.7,2992,0,,,17.0
484,Launching into Machine Learning,Google Cloud,4.6,4069,2,36929,465,22.0
485,Python for Genomic Data Science,Johns Hopkins University,4.3,1337,0,,,17.0
486,Probabilistic Graphical Models 2: Inference,Stanford University,4.6,468,3,21703,73,38.0
487,Computational Social Science Methods,"University of California, Davis",4.7,225,1,8390,61,11.0
488,"The Power of Machine Learning: Boost Business, Accumulate Clicks, Fight Fraud, and Deny Deadbeats",SAS,4.8,125,1,8783,53,14.0
489,Fundamentos de estadística aplicada,Universidad de los Andes,4.4,26,2,3878,13,29.0
490,Базы данных и SQL в обработке и анализе данных,IBM,4.9,8,1,3127,,14.0
491,Introduction to Data Analytics for Business,University of Colorado Boulder,4.7,2758,0,148859,743,12.0
492,Getting and Cleaning Data,Johns Hopkins University,4.6,7845,0,,,17.0
493,The R Programming Environment,Johns Hopkins University,4.3,1112,2,47365,306,27.0
494,Machine Learning Foundations: A Case Study Approach,University of Washington,4.6,12622,0,,,17.0
495,Mathematics for Machine Learning: PCA,Imperial College London,4.0,2675,2,62104,672,18.0
496,Doing More with SAS Programming,SAS,4.8,698,2,21682,119,24.0
497,Introduction to Accounting Data Analytics and Visualization,University of Illinois at Urbana-Champaign,4.8,350,1,18368,58,19.0
498,Launching Machine Learning: Delivering Operational Success with Gold Standard ML Leadership,SAS,4.9,66,1,3166,24,14.0
499,Introduction to TensorFlow,Google Cloud,4.4,2599,2,,,17.0
500,Artificial Intelligence for Breast Cancer Detection,Johns Hopkins University,4.3,6,2,,,15.0
501,Data Analysis and Reporting in SAS Visual Analytics,SAS,4.8,276,0,10512,42,9.0
502,Building Deep Learning Models with TensorFlow,IBM,4.4,574,2,11906,118,13.0
503,Principles of fMRI 1,Johns Hopkins University,4.6,716,1,,,17.0
504,Foundations for Big Data Analysis with SQL,Cloudera,4.8,904,1,37665,227,12.0
505,Inferential Statistical Analysis with Python,University of Michigan,4.6,733,2,29889,130,19.0
506,Structured Query Language (SQL) using SAS,SAS,4.9,115,0,6466,31,24.0
507,Data Visualization,University of Illinois at Urbana-Champaign,4.5,1258,0,,,17.0
508,Building a Data Science Team,Johns Hopkins University,4.5,3186,0,,,17.0
509,Scalable Machine Learning on Big Data using Apache Spark,IBM,3.8,1215,2,19166,308,7.0
510,Supervised Machine Learning: Classification,IBM,4.9,97,2,5573,23,11.0
511,Базы данных (Databases),Saint Petersburg State University,4.0,224,0,21769,68,17.0
512,Digital Marketing Analytics in Practice,University of Illinois at Urbana-Champaign,4.5,3121,1,106886,674,20.0
513,Apache Spark (TM) SQL for Data Analysts,Databricks,4.6,217,2,8546,63,14.0
514,Prediction and Control with Function Approximation,University of Alberta,4.8,671,2,15684,123,22.0
515,大數據分析：商業應用與策略管理 (Big Data Analytics: Business Applications and Strategic Decisions),National Taiwan University,4.7,180,1,13803,43,18.0
516,AI For Medical Treatment,DeepLearning.AI,4.7,445,2,15841,93,23.0
517,IBM Data Analyst Capstone Project,IBM,4.6,252,2,9589,34,14.0
518,Creating Dashboards and Storytelling with Tableau,"University of California, Davis",4.6,845,1,36421,156,15.0
519,Evaluations of AI Applications in Healthcare,Stanford University,4.5,100,1,4442,29,11.0
520,Tools for Exploratory Data Analysis in Business,University of Illinois at Urbana-Champaign,4.8,6,1,1887,,18.0
521,Mastering Data Analysis in Excel,Duke University,4.2,3765,0,,,17.0
522,Visual Analytics with Tableau,"University of California, Davis",4.6,1579,1,39193,301,9.0
523,How Google does Machine Learning,Google Cloud,4.6,6684,2,101751,1052,8.0
524,Digital Marketing Analytics in Theory,University of Illinois at Urbana-Champaign,4.5,4517,1,114283,1092,20.0
525,Getting started with TensorFlow 2,Imperial College London,4.9,371,2,21983,131,26.0
526,Generative Deep Learning with TensorFlow,DeepLearning.AI,4.9,128,2,5664,18,23.0
527,Applied AI with DeepLearning,IBM,4.4,1030,3,47113,177,24.0
528,Statistics for Data Science with Python,IBM,4.6,145,0,8264,34,12.0
529,Data Science Ethics,University of Michigan,4.8,597,1,23019,168,15.0
530,Introduction to Big Data,University of California San Diego,4.6,9966,0,,,17.0
531,Getting Started with Data Analytics on AWS,Amazon Web Services,4.7,75,1,5492,16,4.0
532,Visualization for Data Journalism,University of Illinois at Urbana-Champaign,4.4,48,1,5832,20,18.0
533,Анализ и обработка данных в Microsoft Power BI,Moscow Institute of Physics and Technology,4.5,35,1,3976,12,10.0
534,"Statistical Thinking for Industrial Problem Solving, presented by JMP",SAS,4.8,45,1,3387,18,44.0
535,Introduction to R Programming for Data Science,IBM,4.7,55,1,4735,16,10.0
536,Genomic Data Science with Galaxy,Johns Hopkins University,3.6,911,0,,,17.0
537,Обучение на размеченных данных,Moscow Institute of Physics and Technology,4.8,2567,2,33697,343,59.0
538,Data Science in Stratified Healthcare and Precision Medicine,The University of Edinburgh,4.6,234,2,15656,62,17.0
539,"Applied Plotting, Charting & Data Representation in Python",University of Michigan,4.5,5808,2,155239,988,17.0
540,Data Visualization with Advanced Excel,PwC,4.8,2708,1,76278,431,15.0
541,Essential Design Principles for Tableau,"University of California, Davis",4.5,1706,1,43457,287,13.0
542,An Intuitive Introduction to Probability,University of Zurich,4.7,1167,1,45317,466,30.0
543,Getting Started with AI using IBM Watson,IBM,4.5,2218,1,30898,430,10.0
544,Statistics with SAS,SAS,4.8,220,2,20985,65,20.0
545,Getting Started with SAS Visual Analytics,SAS,4.7,638,1,19755,123,5.0
546,Applied Machine Learning in Python,University of Michigan,4.6,7540,2,241480,1377,34.0
547,Probability and Statistics: To p or not to p?,University of London,4.6,1216,1,61811,423,16.0
548,AI for Medical Prognosis,DeepLearning.AI,4.7,669,2,17999,116,31.0
549,Research Data Management and Sharing,The University of North Carolina at Chapel Hill,4.7,533,0,27121,151,17.0
550,Machine Translation,Karlsruhe Institute of Technology,4.5,53,2,,,17.0
551,Distributed Computing with Spark SQL,"University of California, Davis",4.5,334,2,21657,82,14.0
552,Analítica de Procesos: Optimización desde los Datos,Universidad de los Andes,4.5,,1,,,11.0
553,Introduction to Deep Learning & Neural Networks with Keras,IBM,4.7,920,2,19882,187,8.0
554,"Foundations of Sports Analytics: Data, Representation, and Models in Sports",University of Michigan,4.5,34,0,4686,11,49.0
555,A Crash Course in Data Science,Johns Hopkins University,4.5,7693,0,,,17.0
556,Julia Scientific Programming,University of Cape Town,4.5,383,1,30593,130,18.0
557,The Unix Workbench,Johns Hopkins University,4.7,1244,1,46597,380,19.0
558,DataOps Methodology,IBM,4.5,,1,,,10.0
559,"Big Data Analysis: Hive, Spark SQL, DataFrames and GraphFrames",Yandex,4.0,193,3,28788,43,37.0
560,Supervised Machine Learning: Regression,IBM,4.7,154,2,6924,35,11.0
561,Advanced Machine Learning and Signal Processing,IBM,4.5,1158,3,37168,210,27.0
562,Introduction to Data Analysis Using Excel,Rice University,4.7,8847,0,,,17.0
563,Apply Generative Adversarial Networks (GANs),DeepLearning.AI,4.8,361,2,11671,75,28.0
564,Introduction to Probability and Data with R,Duke University,4.7,4925,1,231485,1183,14.0
565,Applied Data Science Capstone,IBM,4.7,5570,2,84401,728,10.0
566,Problem Solving with Excel,PwC,4.7,4880,1,115731,886,20.0
567,Machine Learning Foundations for Product Managers,Duke University,4.5,,1,,,16.0
568,Fundamentals of Scalable Data Science,IBM,4.3,1910,1,59588,422,20.0
569,Improving your statistical inferences,Eindhoven University of Technology,4.9,693,2,56880,227,28.0
570,Deep Neural Networks with PyTorch,IBM,4.4,944,2,27762,220,31.0
571,Business Metrics for Data-Driven Companies,Duke University,4.6,7952,0,,,17.0
572,Getting Started with AWS Machine Learning,Amazon Web Services,4.5,5980,2,180820,1443,17.0
573,Hadoop Platform and Application Framework,University of California San Diego,4.0,3258,0,,,17.0
574,Sample-based Learning Methods,University of Alberta,4.7,986,2,19674,202,22.0
575,Practical Time Series Analysis,The State University of New York,4.6,1356,2,60634,385,26.0
576,Optimize ML Models and Deploy Human-in-the-Loop Pipelines,DeepLearning.AI,4.8,35,3,2081,9,11.0
577,Introduction to Computer Vision and Image Processing,IBM,4.5,650,1,21073,125,21.0
578,Basic Statistics,University of Amsterdam,4.6,3920,1,,,17.0
579,Computational Neuroscience,University of Washington,4.6,883,1,,,17.0
580,Introduction to Genomic Technologies,Johns Hopkins University,4.6,3595,0,,,17.0
581,Introduction to Designing Data Lakes on AWS,Amazon Web Services,4.7,61,2,5718,25,14.0
582,"Capstone: Retrieving, Processing, and Visualizing Data with Python",University of Michigan,4.7,11755,0,,,17.0
583,Excel aplicado a los negocios (Nivel Avanzado),Universidad Austral,4.8,2254,2,131423,967,17.0
584,R Programming,Johns Hopkins University,4.5,21217,2,,,17.0
585,Process Mining: Data science in Action,Eindhoven University of Technology,4.7,965,2,,,17.0
586,Введение в машинное обучение,HSE University,4.6,2396,0,108468,490,17.0
587,Introduction to Clinical Data,Stanford University,4.6,126,1,6889,26,12.0
588,Probability Theory: Foundation for Data Science,University of Colorado Boulder,4.4,8,2,4056,,48.0
