,title,institute,rate,ratingscount,level,enrollment,review_num,required_hour
0,AI Applications in People Management,University of Pennsylvania,4.5,,0,,,10.0
1,Einführung in die Datenanalyse mit Excel,Rice University,4.5,,0,,,17.0
2,Dashboarding and Deployment,"University of California, Irvine",4.5,,0,,,9.0
3,Data Science at Scale - Capstone Project,University of Washington,4.1,22,0,,,17.0
4,Big Data Services: Capstone Project,Yandex,4.5,,3,1768,,3.0
5,Serverless Machine Learning with Tensorflow on Google Cloud em Português Brasileiro,Google Cloud,4.4,13,2,,,14.0
6,Feature Engineering em Português Brasileiro,Google Cloud,4.5,13,2,,,18.0
7,Prepare for DP-203: Data Engineering on Microsoft Azure Exam,Microsoft,4.5,,2,,,5.0
8,Operational Analytics with Microsoft Azure Synapse Analytics,Microsoft,4.5,,2,,,12.0
9,Azure Data Lake Storage Gen2 and Data Streaming Solution,Microsoft,4.5,,2,,,9.0
10,AI Strategy and Governance,University of Pennsylvania,4.5,,1,,,10.0
11,Последовательные модели,DeepLearning.AI,4.5,,2,,,16.0
12,Trabalho de conclusão de Ciência de Dados Aplicada,IBM,4.5,,2,,,47.0
13,Business Intelligence con la Product Suite di Tableau,Università di Napoli Federico II,4.5,,3,,,25.0
14,Заключительный курс по теме «Прикладная наука о данных»,IBM,4.5,,2,,,47.0
15,Data Storytelling,"University of California, Irvine",4.5,,0,,,9.0
16,Building Resilient Streaming Systems on GCP em Português Brasileiro,Google Cloud,4.1,15,2,,,10.0
17,Art and Science of Machine Learning en Français,Google Cloud,4.5,,2,,,18.0
18,Art and Science of Machine Learning 日本語版,Google Cloud,4.3,7,2,,,18.0
19,كابستون علوم البيانات التطبيقية,IBM,4.5,,2,,,47.0
20,مؤثرات عرض البيانات باستخدام لغة بايثون,IBM,4.5,,2,,,17.0
21,Launching into Machine Learning em Português Brasileiro,Google Cloud,4.5,30,2,,6,20.0
22,Serverless Machine Learning with Tensorflow on Google Cloud auf Deutsch,Google Cloud,4.5,,2,,,15.0
23,منهجية علم البيانات,IBM,4.5,,1,,,10.0
24,Améliorez les réseaux neuronaux profonds,DeepLearning.AI,4.5,,1,,,18.0
25,Подготовка и анализ данных в Tableau,Moscow Institute of Physics and Technology,4.5,,3,,,5.0
26,Sprachtechnologie in den Digital Humanities,University of Zurich,4.8,22,1,,,17.0
27,Intro to TensorFlow em Português Brasileiro,Google Cloud,4.6,23,2,,,18.0
28,Art and Science of Machine Learning em Português Brasileiro,Google Cloud,4.6,14,2,,,19.0
29,TensorFlow を使った畳み込みニューラルネットワーク,DeepLearning.AI,4.5,,2,,,10.0
30,Creación de aplicaciones de IA con las API de Watson,IBM,4.5,,2,,,19.0
31,Visualização de dados com o Python,IBM,4.5,,2,,,17.0
32,Structurer des projets d’apprentissage automatique,DeepLearning.AI,4.5,,1,,,5.0
33,الحصول على البيانات وتنظيفها,Johns Hopkins University,4.5,,0,,,17.0
34,Повышение эффективности глубоких нейросетей,DeepLearning.AI,4.5,,1,,,18.0
35,تحليل البيانات الاستكشافية,Johns Hopkins University,4.5,,0,,,17.0
36,تعزيز الشبكات العصبية : ضبط وتحسين مقياس فرط المعلمات,DeepLearning.AI,4.5,,1,,,18.0
37,النماذج المتعاقبة,DeepLearning.AI,4.5,,2,,,16.0
38,Exploring NCAA Data with BigQuery,Google Cloud,4.5,,1,,,45.0
39,Modèles de séquence,DeepLearning.AI,4.5,,2,,,16.0
40,Ein Crashkurs in Datenwissenschaft,Johns Hopkins University,4.5,,0,,,17.0
41,Art and Science of Machine Learning en Español,Google Cloud,4.6,25,2,2210,10,20.0
42,Линейные модели с дискретными предикторами,Saint Petersburg State University,4.5,,2,,,12.0
43,Смешанные линейные модели,Saint Petersburg State University,4.5,,2,,,16.0
44,Intro to TensorFlow 日本語版,Google Cloud,3.9,11,2,,,19.0
45,Cours intensif sur la science des données,Johns Hopkins University,4.5,,0,,,17.0
46,Быстрый старт с Tableau Desktop,Moscow Institute of Physics and Technology,4.5,,1,,,11.0
47,Launching into Machine Learning en Français,Google Cloud,4.5,10,2,,3,20.0
48,Обобщенные линейные модели,Saint Petersburg State University,4.5,,2,,,16.0
49,Feature Engineering 日本語版,Google Cloud,4.4,9,2,,,18.0
50,Структурирование проектов по машинному обучению,DeepLearning.AI,4.5,,1,,,5.0
51,Data Storage in Microsoft Azure for Associate Developers,Microsoft,4.5,,2,,,16.0
52,Сверточные нейронные сети,DeepLearning.AI,4.5,,2,,,20.0
53,Proyecto Final de Analítica de Datos,IBM,4.5,,2,,,13.0
54,Neuronale Netze und Deep Learning,DeepLearning.AI,4.5,,2,,,20.0
55,Réseaux neuronaux convolutifs,DeepLearning.AI,4.5,,2,,,20.0
56,Communicating Data Science Results,University of Washington,3.6,134,0,15438,37,8.0
57,How Google does Machine Learning em Português Brasileiro,Google Cloud,4.8,72,2,,20,9.0
58,How Google does Machine Learning en Français,Google Cloud,4.3,15,2,,,8.0
59,Intro to TensorFlow en Français,Google Cloud,4.5,,2,,,19.0
60,الشبكات العصبونية الالتفافية,DeepLearning.AI,4.5,,2,,,20.0
61,Визуализация данных с помощью Python,IBM,4.5,,2,,,17.0
62,قواعد البيانات وSQL (لغة الاستعلام البنيوية) لعلم البيانات,IBM,4.5,,1,,,14.0
63,Recommender Systems Capstone,University of Minnesota,4.2,27,0,1683,,3.0
64,هيكلة مشاريع التعلم الآلي,DeepLearning.AI,4.5,,1,,,5.0
65,Mastering Software Development in R Capstone,Johns Hopkins University,4.0,41,2,1683,11,3.0
66,Инструментальная фонетика: компьютерные методы сбора и анализа данных,HSE University,4.5,,0,,,17.0
67,Intermediate Machine Learning: TensorFlow on Google Cloud,Google Cloud,4.5,,2,,,5.0
68,ما علم البيانات؟,IBM,4.5,,1,,,10.0
69,Feature Engineering en Español,Google Cloud,4.5,24,2,2386,8,18.0
70,Metodologia de Ciência de Dados,IBM,4.5,,1,,,10.0
71,Nursing Informatics Leadership Theory and Practice,University of Minnesota,4.7,35,1,1710,,19.0
72,Natural Language Processing and Capstone Assignment,"University of California, Irvine",4.4,14,2,,,5.0
73,‏SQL لعلوم البيانات,"University of California, Davis",4.5,,1,,,14.0
74,Advanced Machine Learning: Machine Learning Infrastructure,Google Cloud,4.5,,3,,,5.0
75,Машинное обучение на больших данных,HSE University,4.5,,2,,,48.0
76,Data Mining Project,University of Illinois at Urbana-Champaign,4.6,38,0,5939,8,11.0
77,Data Mining Project,University of Illinois at Urbana-Champaign,4.6,38,0,,,37.0
78,Data Analysis and Interpretation Capstone,Wesleyan University,4.7,40,0,,,17.0
79,Launching into Machine Learning en Español,Google Cloud,4.7,94,2,2907,23,20.0
80,Launching into Machine Learning 日本語版,Google Cloud,4.4,49,2,,9,20.0
81,Limpieza de datos para el procesamiento de lenguaje natural,Universidad Austral,4.5,,1,,,13.0
82,Fundamentals of  CNNs and RNNs,Sungkyunkwan University,3.8,8,1,,,5.0
83,مقاييس الأعمال للشركات التي تعتمد على البيانات,Duke University,4.5,11,0,,,17.0
84,Машинное обучение с использованием Python,IBM,4.5,,2,,,22.0
85,Meaningful Predictive Modeling,University of California San Diego,4.4,45,2,5120,9,9.0
86,"Understanding China, 1700-2000: A Data Analytic Approach, Part 2",The Hong Kong University of Science and Technology,4.6,50,0,,,17.0
87,Тренды и классификации,Novosibirsk State University ,4.5,37,2,3533,,19.0
88,Что такое обработка и анализ данных?,IBM,4.5,,1,,,10.0
89,Foundations of mining non-structured medical data,EIT Digital ,4.0,20,1,2307,8,7.0
90,AI Workflow: Enterprise Model Deployment,IBM,4.2,44,3,1934,9,9.0
91,Reproducible Templates for Analysis and Dissemination,Emory University,4.6,16,1,1777,10,20.0
92,Data Visualization Best Practices,"University of California, Irvine",4.5,,0,,,9.0
93,Capstone: Analyzing (Social) Network Data,University of California San Diego,4.7,97,0,,,17.0
94,Машинное обучение для руководителей,E-Learning Development Fund,4.4,14,1,,,5.0
95,Réseaux neuronaux et Deep Learning,DeepLearning.AI,4.5,,2,,,20.0
96,Data Mining Project,University of Colorado Boulder,4.5,,2,5939,8,11.0
97,Data Mining Project,University of Colorado Boulder,4.5,,2,,,37.0
98,Hands-on Text Mining and Analytics,Yonsei University,3.9,39,2,13292,9,13.0
99,Линейная регрессия,Saint Petersburg State University,4.9,11,2,1536,,14.0
100,التعلّم الآلي باستخدام لغة بايثون,IBM,4.5,,2,,,22.0
101,Neural Networks and Random Forests,LearnQuest,4.5,,2,,,10.0
102,Big Data: capstone project,Universitat Autònoma de Barcelona,4.7,48,3,3881,22,13.0
103,Data Analytics Foundations for Accountancy II,University of Illinois at Urbana-Champaign,4.8,8,0,2881,,17.0
104,AI Workflow: AI in Production,IBM,4.5,41,3,2336,10,17.0
105,Introducción al Aprendizaje Profundo,Universidad Austral,4.5,,1,,,7.0
106,Causal Inference  2,Columbia University,3.4,13,3,3601,,6.0
107,Importing Data in the Tidyverse,Johns Hopkins University,4.6,20,1,,3,15.0
108,R البرمجة باستخدام لغة,Johns Hopkins University,4.5,,2,,,59.0
109,Combining and Analyzing Complex Data,"University of Maryland, College Park",4.2,54,0,7049,8,10.0
110,Data for Machine Learning,Alberta Machine Intelligence Institute,4.4,87,2,6200,24,12.0
111,Visualizing Data in the Tidyverse,Johns Hopkins University,4.4,7,0,,,17.0
112,Capstone Project: Predicting Safety Stock,LearnQuest,4.5,,2,,,10.0
113,Estadísticas para la Ciencia de Datos con Python,IBM,4.5,,0,,,12.0
114,Practical Predictive Analytics: Models and Methods,University of Washington,4.1,306,0,,,17.0
115,Global Statistics - Composite Indices for International Comparisons,University of Geneva,4.6,37,2,2809,18,16.0
116,Introduction à l'analyse de données à l'aide d'Excel,Rice University,4.5,,0,,,17.0
117,"Cluster Analysis, Association Mining, and Model Evaluation","University of California, Irvine",4.6,22,2,,,4.0
118,"Build Regression, Classification, and Clustering Models",CertNexus,4.5,,2,,,20.0
119,مجموعة أدوات عالم البيانات,Johns Hopkins University,4.5,8,0,,,17.0
120,Advanced Clinical Data Science,University of Colorado System,4.9,8,2,,,4.0
121,Structural Equation Model and its Applications | 结构方程模型及其应用 (粤语),The Chinese University of Hong Kong,4.8,20,0,2398,,17.0
122,Optimizing Machine Learning Performance,Alberta Machine Intelligence Institute,4.6,38,0,5319,8,12.0
123,Python para a Ciência de Dados e IA,IBM,4.5,,1,,,29.0
124,Методология обработки и анализа данных,IBM,4.5,,1,,,10.0
125,Visualizing & Communicating Results in Python with Jupyter,Codio,4.5,,1,,,9.0
126,Advanced Linear Models for Data Science 2: Statistical Linear Models,Johns Hopkins University,4.6,70,3,19829,12,6.0
127,Introduction to Formal Concept Analysis,HSE University,4.8,36,2,7385,14,26.0
128,Estimating ML-Models Financial Impact,HSE University,4.5,,2,,,20.0
129,Machine Learning Models in Science,LearnQuest,4.5,,2,,,12.0
130,Using SAS Viya REST APIs with Python and R,SAS,4.5,11,0,2910,,17.0
131,Visualizing Data & Communicating Results in R with RStudio,Codio,4.5,,1,,,10.0
132,Big Data Applications: Machine Learning at Scale,Yandex,3.8,86,3,10807,22,28.0
133,Design Thinking and Predictive Analytics for Data Products,University of California San Diego,4.5,61,2,7668,11,8.0
134,Practical Machine Learning on H2O,H2O,4.5,70,2,7291,17,24.0
135,"Build Decision Trees, SVMs, and Artificial Neural Networks",CertNexus,5.0,6,2,,,22.0
136,Wrangling Data in the Tidyverse,Johns Hopkins University,4.8,14,0,,5,14.0
137,بايثون لعلوم البيانات والذكاء الصناعي,IBM,4.5,,1,,,29.0
138,الشبكات العصبية والتعلم العميق,DeepLearning.AI,4.6,9,2,3446,,19.0
139,Doing Clinical Research: Biostatistics with the Wolfram Language,University of Cape Town,4.7,38,1,3674,10,15.0
140,Clinical Natural Language Processing,University of Colorado System,3.4,18,2,3669,9,12.0
141,"Predictive Modeling, Model Fitting, and Regression Analysis","University of California, Irvine",4.5,24,2,,2,4.0
142,Fundamentals of Data Analysis,LearnQuest,4.2,9,1,,,18.0
143,Статистические методы в гуманитарных исследованиях,National Research Tomsk State University,4.7,61,2,5506,20,20.0
144,Advanced Recommender Systems,EIT Digital ,4.0,7,2,,,15.0
145,Artificial Intelligence Privacy and Convenience,LearnQuest,4.6,37,2,1832,9,6.0
146,Statistics with R Capstone,Duke University,4.6,202,0,7354,51,6.0
147,Artificial Intelligence Ethics in Action,LearnQuest,4.7,22,2,1736,,6.0
148,ANOVA and Experimental Design,University of Colorado Boulder,4.5,,2,,,39.0
149,Practical SAS Programming and Certification Review,SAS,4.9,350,2,13228,62,21.0
150,مقدمة عن البيانات الضخمة,University of California San Diego,4.5,79,0,2440,,17.0
151,Case studies in business analytics with ACCENTURE,ESSEC Business School,3.7,196,0,,,17.0
152,Data Mining Methods,University of Colorado Boulder,4.5,,2,,,22.0
153,Deploying Machine Learning Models,University of California San Diego,3.6,47,0,8484,14,11.0
154,Data Science Project: MATLAB for the Real World,MathWorks,4.8,15,2,2877,8,13.0
155,Matrix Factorization and Advanced Techniques,University of Minnesota,4.3,177,0,13378,26,16.0
156,Bayesian Statistics: Mixture Models,"University of California, Santa Cruz",4.7,23,3,5117,8,22.0
157,Power and Sample Size for Multilevel and Longitudinal Study Designs,University of Florida,4.4,23,2,3588,4,24.0
158,Introduction to the Tidyverse,Johns Hopkins University,3.9,19,1,1617,,8.0
159,Simulation Models for Decision Making,University of Minnesota,4.4,8,1,,,17.0
160,Обработка больших данных,HSE University,4.5,,2,,,42.0
161,人工智慧：機器學習與理論基礎 (Artificial Intelligence - Learning & Theory),National Taiwan University,4.6,38,2,7473,3,12.0
162,O que é ciência de dados?,IBM,4.5,,1,,,10.0
163,Знакомство с R и базовая статистика,Saint Petersburg State University,4.8,68,1,6249,18,20.0
164,Iniciación A La IA con IBM Watson,IBM,4.7,44,1,,9,9.0
165,Data Science for Business Innovation,EIT Digital ,4.3,166,1,7621,49,7.0
166,Введение в науку о данных (An Introduction to Data Science),Saint Petersburg State University,3.9,54,0,7433,,17.0
167,機器學習技法 (Machine Learning Techniques),National Taiwan University,4.9,20,2,,,17.0
168,Fundamentos de la visualización de datos con Tableau,Universidad Austral,4.7,23,1,,9,8.0
169,Data Analytics Foundations for Accountancy I,University of Illinois at Urbana-Champaign,4.3,28,0,7117,10,17.0
170,Structural Equation Model and its Applications | 结构方程模型及其应用 (普通话),The Chinese University of Hong Kong,4.7,76,0,7296,36,17.0
171,Increasing Real Estate Management Profits: Harnessing Data Analytics,Duke University,4.7,230,0,12987,51,23.0
172,"Intro to Analytic Thinking, Data Science, and Data Mining","University of California, Irvine",4.0,50,2,2803,11,7.0
173,Machine Learning Algorithms: Supervised Learning Tip to Tail,Alberta Machine Intelligence Institute,4.7,368,0,12958,61,9.0
174,Turn Ethical Frameworks into Actionable Steps,CertNexus,4.4,50,1,2698,8,15.0
175,Detect and Mitigate Ethical Risks,CertNexus,4.3,42,1,2614,,19.0
176,Relational database systems,Universidad Nacional Autónoma de México,4.1,192,2,17197,49,15.0
177,Enjoyable Econometrics,Erasmus University Rotterdam,4.2,49,1,12574,17,17.0
178,Communicate Effectively about Ethical Challenges in Data-Driven Technologies,CertNexus,4.2,31,1,2070,,14.0
179,Create and Lead an Ethical Data-Driven Organization,CertNexus,4.3,37,1,1999,,13.0
180,Predictive Modeling and Machine Learning with MATLAB,MathWorks,4.7,78,2,10237,22,22.0
181,Data Science Capstone,Johns Hopkins University,4.5,1183,0,,,17.0
182,Data Analysis in Python with pandas & matplotlib in Spyder,Codio,4.5,,1,,,10.0
183,Microsoft Azure Databricks for Data Engineering,Microsoft,4.5,,2,,,22.0
184,Visualización de Datos con Python,IBM,4.9,8,2,,,18.0
185,Aprendizaje Automático con Python,IBM,4.5,,2,,,22.0
186,Causal Inference,Columbia University,3.4,56,3,,,17.0
187,Aprendizado de máquina com Python,IBM,4.5,,2,,,22.0
188,Business intelligence and data warehousing,Universidad Nacional Autónoma de México,3.9,87,2,9780,22,10.0
189,Исследование статистических взаимосвязей,Novosibirsk State University ,4.7,69,2,4485,,21.0
190,Data Analysis Tools,Wesleyan University,4.5,397,0,,,17.0
191,Machine Learning for Data Analysis,Wesleyan University,4.2,305,0,,,17.0
192,Regression Modeling in Practice,Wesleyan University,4.4,269,0,,,17.0
193,Clinical Data Models and Data Quality Assessments,University of Colorado System,4.2,52,2,4831,16,17.0
194,Big Data - Capstone Project,University of California San Diego,4.4,379,0,,,17.0
195,Продвинутые методы машинного обучения,HSE University,4.5,,2,,,45.0
196,Big Data: visualización de datos,Universitat Autònoma de Barcelona,4.6,149,2,9762,60,9.0
197,Intro to TensorFlow en Español,Google Cloud,4.4,118,2,3579,28,18.0
198,Feature Engineering en Français,Google Cloud,4.5,,2,,,18.0
199,How Google does Machine Learning en Español,Google Cloud,4.6,191,2,6041,64,8.0
200,Dealing With Missing Data,"University of Maryland, College Park",3.8,118,0,9965,33,18.0
201,Machine Learning: Clustering & Retrieval,University of Washington,4.6,2231,0,85636,382,17.0
202,Genomic Data Science Capstone,Johns Hopkins University,4.5,60,0,2855,21,17.0
203,NoSQL systems,Universidad Nacional Autónoma de México,4.2,115,2,8750,26,9.0
204,Data Visualization Capstone,Johns Hopkins University,4.9,14,0,,5,22.0
205,Designing data-intensive applications,Universidad Nacional Autónoma de México,4.5,30,2,5796,,7.0
206,Network Analysis,HSE University,4.5,,1,,,17.0
207,Introduction to Text Mining with R,HSE University,4.5,,1,,,11.0
208,Modeling Data in the Tidyverse,Johns Hopkins University,4.5,,0,,,21.0
209,Data Analysis and Presentation Skills: the PwC Approach Final Project,PwC,4.8,224,1,3435,46,11.0
210,How Google does Machine Learning 日本語版,Google Cloud,4.5,126,2,2403,22,8.0
211,Promote the Ethical Use of Data-Driven Technologies,CertNexus,4.6,83,1,4936,16,21.0
212,Identifying Patient Populations,University of Colorado System,4.5,31,2,2121,10,13.0
213,Relational Database Support for Data Warehouses,University of Colorado System,4.6,575,0,,,17.0
214,Análisis de datos con Python,IBM,4.8,11,1,,4,24.0
215,Design and Build a Data Warehouse for Business Intelligence Implementation,University of Colorado System,4.6,252,0,,,17.0
216,Predict Visitor Purchases with a Classification Model in BQML,Google Cloud,4.5,,2,,,2.0
217,Data Management and Visualization,Wesleyan University,4.4,882,0,,,17.0
218,Solve Business Problems with AI and Machine Learning,CertNexus,4.8,9,2,1509,,11.0
219,Recommender Systems:  Evaluation and Metrics,University of Minnesota,4.4,216,0,11105,30,7.0
220,Quantifying Relationships with Regression Models,Johns Hopkins University,4.8,9,2,,,11.0
221,Google Cloud Platform Big Data and Machine Learning Fundamentals em Português Brasileiro,Google Cloud,4.8,65,2,1660,12,12.0
222,Follow a Machine Learning Workflow,CertNexus,4.5,,2,,,20.0
223,Python per la Data Science,Università di Napoli Federico II,4.5,,2,,,18.0
224,Artificial Intelligence Algorithms Models and Limitations,LearnQuest,4.7,101,1,4523,25,8.0
225,Введение в анализ данных сайтов,Saint Petersburg State University,4.5,,1,,,8.0
226,Factorial and Fractional Factorial Designs,Arizona State University,4.7,40,2,2848,9,12.0
227,Data Manipulation at Scale: Systems and Algorithms,University of Washington,4.3,752,0,,,17.0
228,"Response Surfaces, Mixtures, and Model Building",Arizona State University,4.7,45,2,2167,12,13.0
229,Advanced Models for Decision Making,University of Minnesota,4.8,9,1,,,14.0
230,"Random Models, Nested and Split-plot Designs",Arizona State University,4.6,27,2,1840,5,9.0
231,Сравнение и создание групп,Novosibirsk State University ,4.5,38,2,2671,,22.0
232,Ciencia de Datos Aplicada - Curso Capstone,IBM,4.9,7,2,,,47.0
233,Developing Data Products,Johns Hopkins University,4.6,2209,0,,,17.0
234,Data Engineering with MS Azure Synapse Apache Spark Pools,Microsoft,4.5,,2,,,7.0
235,Google Cloud Big Data and Machine Learning Fundamentals en Français,Google Cloud,4.3,25,2,1792,4,13.0
236,Introduction to PyMC3 for Bayesian Modeling and Inference,Databricks,4.5,,1,,,12.0
237,Bayesian Inference with MCMC,Databricks,4.5,,1,,,15.0
238,Building Data Visualization Tools,Johns Hopkins University,3.9,151,2,11270,40,13.0
239,Анализ данных: финальный проект,Moscow Institute of Physics and Technology,4.7,323,3,3741,64,44.0
240,Introduction to Machine Learning: Language Processing,Google Cloud,4.2,10,1,,,4.0
241,Python para Data Science y AI,IBM,4.8,25,1,,10,26.0
242,Data Visualization e manipolazione dei dati con Tableau,Università di Napoli Federico II,4.5,,2,,,19.0
243,Bases de datos y SQL para ciencia de datos,IBM,4.1,18,1,,7,14.0
244,Introduction to Recommender Systems:  Non-Personalized and Content-Based,University of Minnesota,4.5,592,2,30796,124,23.0
245,Introduction to Applied Machine Learning,Alberta Machine Intelligence Institute,4.7,614,2,19060,147,7.0
246,Machine Learning for Accounting with Python,University of Illinois at Urbana-Champaign,4.6,26,2,6131,,64.0
247,Communicating Business Analytics Results,University of Colorado Boulder,4.5,416,0,20333,86,7.0
248,Business Analytics for Decision Making,University of Colorado Boulder,4.6,1621,0,72526,418,9.0
249,Geospatial Analysis Project,"University of California, Davis",4.8,229,0,8360,69,62.0
250,Nearest Neighbor Collaborative Filtering,University of Minnesota,4.3,292,0,12464,66,15.0
251,Capstone Project: Advanced AI for Drug Discovery,LearnQuest,4.5,,2,,,12.0
252,Contemporary Data Analysis: Survey and Best Practices,HSE University,4.5,,1,,,16.0
253,Data Science on Google Cloud,Google Cloud,4.5,,3,,,12.0
254,Data Science on Google Cloud: Machine Learning,Google Cloud,4.5,,3,,,7.0
255,Business Statistics and Analysis Capstone,Rice University,4.7,370,0,14205,70,7.0
256,Data Warehousing with Microsoft Azure Synapse Analytics,Microsoft,4.5,,2,,,15.0
257,Статистические методы анализа данных,HSE University,4.5,,2,,,22.0
258,Computational Social Science Capstone Project,"University of California, Davis",4.6,23,2,1953,8,14.0
259,Математическая статистика и А/В тестирование,HSE University,4.5,,2,,,25.0
260,Image Understanding with TensorFlow on GCP,Google Cloud,4.6,499,3,13203,58,12.0
261,Big Data: procesamiento y análisis,Universitat Autònoma de Barcelona,4.2,228,2,12287,89,13.0
262,Bayesian Methods for Machine Learning,HSE University,4.5,676,3,67795,197,33.0
263,AI Workflow: Feature Engineering and Bias Detection,IBM,4.5,60,3,2578,7,12.0
264,Generalized Linear Models and Nonparametric Regression,University of Colorado Boulder,4.5,,2,,,42.0
265,Human Factors in AI,Duke University,4.5,,1,,,17.0
266,Introduzione alla Data Visualization con Tableau,Università di Napoli Federico II,4.5,,1,,,18.0
267,Visualización de Datos y Tableros con Excel y Cognos,IBM,4.3,18,1,,9,10.0
268,Machine Learning e Data Mining in R,Università di Napoli Federico II,4.5,,2,,,31.0
269,Optimization for Decision Making,University of Minnesota,4.9,7,1,,,14.0
270,Data Processing and Feature Engineering with MATLAB,MathWorks,4.7,294,2,11455,103,18.0
271,BigQuery Basics for Data Analysts,Google Cloud,4.6,30,1,,1,5.0
272,Building Advanced Codeless Pipelines on Cloud Data Fusion,Google Cloud,4.5,,3,,,6.0
273,Нейронные сети и глубокое обучение,DeepLearning.AI,4.5,,2,,,20.0
274,"Understanding China, 1700-2000: A Data Analytic Approach, Part 1",The Hong Kong University of Science and Technology,4.6,106,0,,,17.0
275,Demand Forecasting Using Time Series,LearnQuest,4.5,,2,,,9.0
276,Spatial Data Science and Applications,Yonsei University,4.4,407,2,17976,135,12.0
277,Math behind Moneyball,University of Houston,4.5,89,1,,,17.0
278,Practical Reinforcement Learning,HSE University,4.2,437,3,43434,116,26.0
279,Google Cloud Big Data and Machine Learning Fundamentals en Español,Google Cloud,4.7,616,2,17619,198,13.0
280,Statistical Inference and Hypothesis Testing in Data Science Applications,University of Colorado Boulder,4.5,,2,,,34.0
281,"AI Workflow: Machine Learning, Visual Recognition and NLP",IBM,4.5,60,3,2777,9,14.0
282,AI Workflow: Business Priorities and Data Ingestion,IBM,4.3,139,2,4290,33,8.0
283,Методология научных исследований и котики,National Research Tomsk State University,4.7,51,1,6261,14,14.0
284,Publishing Visualizations in R with Shiny and flexdashboard,Johns Hopkins University,4.9,22,0,1725,7,12.0
285,Advanced Data Visualization with R,Johns Hopkins University,4.8,31,0,1869,11,11.0
286,Python: обработка и анализ данных и ИИ,IBM,4.5,,1,,,29.0
287,Introduction to Microsoft Azure Synapse Analytics,Microsoft,4.5,,2,,,8.0
288,Estatística não-paramétrica para a tomada de decisão,Universidade de São Paulo,4.4,108,2,9098,31,13.0
289,Introdução ao Big Data,Fundação Instituto de Administração,4.6,306,1,14669,91,16.0
290,Improving Your Statistical Questions,Eindhoven University of Technology,4.9,89,2,5515,19,18.0
