,title,institute,rate,ratingscount,level,enrollment,review_num,required_hour
589,Introduction to Embedded Machine Learning,Edge Impulse,4.8,184,2,,,17.0
590,"Data Wrangling, Analysis and AB Testing with SQL","University of California, Davis",3.4,401,2,28035,162,16.0
591,Fundamentals of Machine Learning for Healthcare,Stanford University,4.8,158,1,7795,46,12.0
592,Data Analysis Using Python,University of Pennsylvania,4.6,93,1,4161,33,17.0
593,Getting Started with SAS Programming,SAS,4.8,2026,1,65002,459,22.0
594,Computer Vision with Embedded Machine Learning,Edge Impulse,4.5,,2,,,31.0
595,Fundamentals of Visualization with Tableau,"University of California, Davis",4.5,5166,1,134170,1177,11.0
596,Data Analytics for Lean Six Sigma,University of Amsterdam,4.8,2411,1,46020,816,11.0
597,Bayesian Statistics: Techniques and Models,"University of California, Santa Cruz",4.8,418,2,45444,133,30.0
598,Understanding and Visualizing Data with Python,University of Michigan,4.7,2081,1,90006,431,20.0
599,Fundamentos de Excel para Negocios,Universidad Austral,4.8,4114,1,254119,1705,17.0
600,Introducción a Data Science: Programación Estadística con R,Universidad Nacional Autónoma de México,4.7,6985,1,183378,2817,17.0
601,Custom and Distributed Training with TensorFlow,DeepLearning.AI,4.8,217,2,7287,29,25.0
602,Probabilistic Graphical Models 1: Representation,Stanford University,4.6,1354,3,78604,302,67.0
603,A Crash Course in Causality:  Inferring Causal Effects from Observational Data,University of Pennsylvania,4.7,381,2,27134,129,18.0
604,Data-driven Decision Making,PwC,4.6,5603,1,146697,1071,17.0
605,AI for Medical Diagnosis,DeepLearning.AI,4.7,1593,2,45696,349,20.0
606,Build Better Generative Adversarial Networks (GANs),DeepLearning.AI,4.6,462,2,14039,70,30.0
607,Natural Language Processing with Attention Models,DeepLearning.AI,4.4,662,2,31763,166,31.0
608,Natural Language Processing with Sequence Models,DeepLearning.AI,4.5,784,2,33062,160,22.0
609,The Data Scientist’s Toolbox,Johns Hopkins University,4.6,32222,0,,,17.0
610,"Build, Train, and Deploy ML Pipelines using BERT",DeepLearning.AI,4.7,58,3,4352,9,11.0
611,Advanced Computer Vision with TensorFlow,DeepLearning.AI,4.8,245,2,11927,44,25.0
612,Математика и Python для анализа данных,Moscow Institute of Physics and Technology,4.8,5551,1,88344,940,28.0
613,"Sequences, Time Series and Prediction",DeepLearning.AI,4.7,4166,2,84509,673,14.0
614,Machine Learning Modeling Pipelines in Production,DeepLearning.AI,4.6,82,3,6137,18,26.0
615,Deploying Machine Learning Models in Production,DeepLearning.AI,4.8,20,3,3886,3,33.0
616,Introduction to Artificial Intelligence (AI),IBM,4.7,8027,1,142605,1779,17.0
617,"Custom Models, Layers, and Loss Functions with TensorFlow",DeepLearning.AI,4.9,539,2,13857,120,32.0
618,Data Visualization with Python,IBM,4.5,9527,2,132020,1428,17.0
619,Google Cloud Big Data and Machine Learning Fundamentals,Google Cloud,4.7,13765,2,,,17.0
620,Econometrics: Methods and Applications,Erasmus University Rotterdam,4.6,1058,0,,,17.0
621,Bayesian Statistics: From Concept to Data Analysis,"University of California, Santa Cruz",4.6,2792,2,123852,727,12.0
622,Exploratory Data Analysis for Machine Learning,IBM,4.6,419,2,20243,106,8.0
623,Machine Learning with Python,IBM,4.7,11519,2,,,17.0
624,Introduction to Machine Learning,Duke University,4.7,2779,2,,,17.0
625,Google Data Analytics Capstone: Complete a Case Study,Google,4.8,1011,1,42705,144,8.0
626,Natural Language Processing in TensorFlow,DeepLearning.AI,4.6,5614,2,94627,880,15.0
627,Foundations of Data Science: K-Means Clustering in Python,University of London,4.7,349,1,21306,117,29.0
628,Mathematics for Machine Learning: Linear Algebra,Imperial College London,4.7,10094,1,258162,2036,17.0
629,Analyze Datasets and Train ML Models using AutoML,DeepLearning.AI,4.6,134,3,9772,29,15.0
630,Introduction to Data Science in Python,University of Michigan,4.5,24599,2,,,17.0
631,Data Visualization and Dashboards with Excel and Cognos,IBM,4.7,836,1,24111,126,9.0
632,Natural Language Processing with Probabilistic Models,DeepLearning.AI,4.7,1208,2,37953,211,28.0
633,Databases and SQL for Data Science with Python,IBM,4.7,13820,1,211375,1670,19.0
634,Share Data Through the Art of Visualization,Google,4.5,1298,1,52566,278,24.0
635,Sequence Models,DeepLearning.AI,4.8,27046,2,305580,3216,41.0
636,Data Analysis with R Programming,Google,4.8,1164,1,53836,263,37.0
637,Convolutional Neural Networks in TensorFlow,DeepLearning.AI,4.7,6952,2,98697,1083,27.0
638,Data Science Methodology,IBM,4.6,16680,1,158743,2024,8.0
639,Data Analysis with Python,IBM,4.7,13929,1,,,17.0
640,Build Basic Generative Adversarial Networks (GANs),DeepLearning.AI,4.7,1261,2,32940,310,32.0
641,Python Project for Data Science,IBM,4.5,1092,2,34504,211,6.0
642,Fundamentals of Reinforcement Learning,University of Alberta,4.8,2105,2,54685,524,15.0
643,Tools for Data Science,IBM,4.5,22332,1,230836,3492,17.0
644,"Improving Deep Neural Networks: Hyperparameter Tuning, Regularization and Optimization",DeepLearning.AI,4.9,59375,2,416361,6864,17.0
645,Process Data from Dirty to Clean,Google,4.8,2256,1,74982,422,22.0
646,"Python for Data Science, AI & Development",IBM,4.6,23080,1,,,17.0
647,Convolutional Neural Networks,DeepLearning.AI,4.9,39612,2,379915,5239,39.0
648,Analyze Data to Answer Questions,Google,4.6,1613,1,60870,294,26.0
649,Natural Language Processing with Classification and Vector Spaces,DeepLearning.AI,4.6,2955,2,86820,606,31.0
650,Structuring Machine Learning Projects,DeepLearning.AI,4.8,47245,1,350038,5424,9.0
651,Excel Basics for Data Analysis,IBM,4.7,1540,1,56496,286,12.0
652,Machine Learning Data Lifecycle in Production,DeepLearning.AI,4.5,210,3,10922,37,21.0
653,Machine Learning,Stanford University,4.9,163798,0,,,17.0
654,"Foundations: Data, Data, Everywhere",Google,4.8,16817,1,406865,3718,20.0
655,Ask Questions to Make Data-Driven Decisions,Google,4.7,5592,1,133614,894,18.0
656,Neural Networks and Deep Learning,DeepLearning.AI,4.9,109140,2,,,17.0
657,Introduction to Statistics,Stanford University,4.6,377,1,49759,75,15.0
658,What is Data Science?,IBM,4.7,48595,1,,,17.0
659,Prepare Data for Exploration,Google,4.8,3225,1,94477,483,22.0
660,Introduction to Machine Learning in Production,DeepLearning.AI,4.8,824,3,28845,164,10.0
661,Introduction to Data Analytics,IBM,4.8,3435,1,,,17.0
662,SQL for Data Science,"University of California, Davis",4.6,10574,1,,,17.0
